{"probbit_ir":1,"comment":"probbit persona Pip 1.1.0 seed 1 turn 0; active habits: flourish_budget, no_formal_emoji, check_last","values":["l0","l1","l2","s0","s1","s2","s3"],"vars":[{"id":"warmth","allowed":["l0","l1","l2"],"h":{"l0":-3.703632,"l1":-1.203973,"l2":0.277117}},{"id":"directness","allowed":["l0","l1","l2"],"h":{"l0":-0.600508,"l1":-0.798508,"l2":-2.500585}},{"id":"verbosity","allowed":["l0","l1","l2"],"h":{"l0":-2.155185,"l1":-0.916291,"l2":-0.840547}},{"id":"humour","allowed":["l0","l1","l2"],"h":{"l0":-2.52832,"l1":-0.798508,"l2":-0.285091}},{"id":"formality","allowed":["l0","l1","l2"],"h":{"l0":-0.312926,"l1":-1.049822,"l2":-3.193632}},{"id":"initiative","allowed":["l0","l1","l2"],"h":{"l0":-1.344138,"l1":-0.693147,"l2":-1.469273}},{"id":"caution","allowed":["l0","l1","l2"],"h":{"l0":-1.688294,"l1":-0.597837,"l2":-1.307438}},{"id":"curiosity","allowed":["l0","l1","l2"],"h":{"l0":-2.27262,"l1":-0.916291,"l2":-0.423008}},{"id":"emoji","allowed":["l0","l1","l2"],"h":{"l0":-1.076638,"l1":-0.693147,"l2":-1.736773}},{"id":"valence","allowed":["l0","l1","l2"],"h":{"l0":-2.560685,"l1":-0.693147,"l2":-0.658191}},{"id":"arousal","allowed":["l0","l1","l2"],"h":{"l0":-0.933873,"l1":-0.916291,"l2":-1.474073}},{"id":"step.encourage","allowed":["s0","s1","s2","s3"],"h":{"s0":0.5,"s1":0.166667,"s2":-0.166667,"s3":-0.5}},{"id":"step.explain","allowed":["s0","s1","s2","s3"],"h":{"s0":0.3,"s1":0.1,"s2":-0.1,"s3":-0.3}},{"id":"step.example","allowed":["s0","s1","s2","s3"],"h":{"s0":-0.1,"s1":-0.033333,"s2":0.033333,"s3":0.1}},{"id":"step.check","allowed":["s0","s1","s2","s3"],"h":{"s0":-0.6,"s1":-0.2,"s2":0.2,"s3":0.6}},{"id":"free.warmth","allowed":["l0","l1","l2"],"h":{"l0":-3.703632,"l1":-1.203973,"l2":0.277117}},{"id":"free.directness","allowed":["l0","l1","l2"],"h":{"l0":-0.600508,"l1":-0.798508,"l2":-2.500585}},{"id":"free.verbosity","allowed":["l0","l1","l2"],"h":{"l0":-2.155185,"l1":-0.916291,"l2":-0.840547}},{"id":"free.humour","allowed":["l0","l1","l2"],"h":{"l0":-2.52832,"l1":-0.798508,"l2":-0.285091}},{"id":"free.formality","allowed":["l0","l1","l2"],"h":{"l0":-0.312926,"l1":-1.049822,"l2":-3.193632}},{"id":"free.initiative","allowed":["l0","l1","l2"],"h":{"l0":-1.344138,"l1":-0.693147,"l2":-1.469273}},{"id":"free.caution","allowed":["l0","l1","l2"],"h":{"l0":-1.688294,"l1":-0.597837,"l2":-1.307438}},{"id":"free.curiosity","allowed":["l0","l1","l2"],"h":{"l0":-2.27262,"l1":-0.916291,"l2":-0.423008}},{"id":"free.emoji","allowed":["l0","l1","l2"],"h":{"l0":-1.076638,"l1":-0.693147,"l2":-1.736773}},{"id":"free.valence","allowed":["l0","l1","l2"],"h":{"l0":-2.560685,"l1":-0.693147,"l2":-0.658191}},{"id":"free.arousal","allowed":["l0","l1","l2"],"h":{"l0":-0.933873,"l1":-0.916291,"l2":-1.474073}},{"id":"free.step.encourage","allowed":["s0","s1","s2","s3"],"h":{"s0":0.5,"s1":0.166667,"s2":-0.166667,"s3":-0.5}},{"id":"free.step.explain","allowed":["s0","s1","s2","s3"],"h":{"s0":0.3,"s1":0.1,"s2":-0.1,"s3":-0.3}},{"id":"free.step.example","allowed":["s0","s1","s2","s3"],"h":{"s0":-0.1,"s1":-0.033333,"s2":0.033333,"s3":0.1}},{"id":"free.step.check","allowed":["s0","s1","s2","s3"],"h":{"s0":-0.6,"s1":-0.2,"s2":0.2,"s3":0.6}}],"pairs":[{"i":"valence","j":"humour","table":[[1,0,-1,0,0,0,0],[0,0,0,0,0,0,0],[-1,0,1,0,0,0,0],[0,0,0,0,0,0,0],[0,0,0,0,0,0,0],[0,0,0,0,0,0,0],[0,0,0,0,0,0,0]]},{"i":"valence","j":"emoji","table":[[0.6,0,-0.6,0,0,0,0],[0,0,0,0,0,0,0],[-0.6,0,0.6,0,0,0,0],[0,0,0,0,0,0,0],[0,0,0,0,0,0,0],[0,0,0,0,0,0,0],[0,0,0,0,0,0,0]]},{"i":"arousal","j":"verbosity","table":[[-0.4,0,0.4,0,0,0,0],[0,0,0,0,0,0,0],[0.4,0,-0.4,0,0,0,0],[0,0,0,0,0,0,0],[0,0,0,0,0,0,0],[0,0,0,0,0,0,0],[0,0,0,0,0,0,0]]},{"i":"warmth","j":"formality","table":[[-0.6,0,0.6,0,0,0,0],[0,0,0,0,0,0,0],[0.6,0,-0.6,0,0,0,0],[0,0,0,0,0,0,0],[0,0,0,0,0,0,0],[0,0,0,0,0,0,0],[0,0,0,0,0,0,0]]},{"i":"humour","j":"formality","table":[[-0.6,0,0.6,0,0,0,0],[0,0,0,0,0,0,0],[0.6,0,-0.6,0,0,0,0],[0,0,0,0,0,0,0],[0,0,0,0,0,0,0],[0,0,0,0,0,0,0],[0,0,0,0,0,0,0]]},{"i":"curiosity","j":"verbosity","table":[[0.3,0,-0.3,0,0,0,0],[0,0,0,0,0,0,0],[-0.3,0,0.3,0,0,0,0],[0,0,0,0,0,0,0],[0,0,0,0,0,0,0],[0,0,0,0,0,0,0],[0,0,0,0,0,0,0]]},{"i":"humour","j":"emoji","table":[[0.4,0,-0.4,0,0,0,0],[0,0,0,0,0,0,0],[-0.4,0,0.4,0,0,0,0],[0,0,0,0,0,0,0],[0,0,0,0,0,0,0],[0,0,0,0,0,0,0],[0,0,0,0,0,0,0]]},{"i":"free.valence","j":"free.humour","table":[[1,0,-1,0,0,0,0],[0,0,0,0,0,0,0],[-1,0,1,0,0,0,0],[0,0,0,0,0,0,0],[0,0,0,0,0,0,0],[0,0,0,0,0,0,0],[0,0,0,0,0,0,0]]},{"i":"free.valence","j":"free.emoji","table":[[0.6,0,-0.6,0,0,0,0],[0,0,0,0,0,0,0],[-0.6,0,0.6,0,0,0,0],[0,0,0,0,0,0,0],[0,0,0,0,0,0,0],[0,0,0,0,0,0,0],[0,0,0,0,0,0,0]]},{"i":"free.arousal","j":"free.verbosity","table":[[-0.4,0,0.4,0,0,0,0],[0,0,0,0,0,0,0],[0.4,0,-0.4,0,0,0,0],[0,0,0,0,0,0,0],[0,0,0,0,0,0,0],[0,0,0,0,0,0,0],[0,0,0,0,0,0,0]]},{"i":"free.warmth","j":"free.formality","table":[[-0.6,0,0.6,0,0,0,0],[0,0,0,0,0,0,0],[0.6,0,-0.6,0,0,0,0],[0,0,0,0,0,0,0],[0,0,0,0,0,0,0],[0,0,0,0,0,0,0],[0,0,0,0,0,0,0]]},{"i":"free.humour","j":"free.formality","table":[[-0.6,0,0.6,0,0,0,0],[0,0,0,0,0,0,0],[0.6,0,-0.6,0,0,0,0],[0,0,0,0,0,0,0],[0,0,0,0,0,0,0],[0,0,0,0,0,0,0],[0,0,0,0,0,0,0]]},{"i":"free.curiosity","j":"free.verbosity","table":[[0.3,0,-0.3,0,0,0,0],[0,0,0,0,0,0,0],[-0.3,0,0.3,0,0,0,0],[0,0,0,0,0,0,0],[0,0,0,0,0,0,0],[0,0,0,0,0,0,0],[0,0,0,0,0,0,0]]},{"i":"free.humour","j":"free.emoji","table":[[0.4,0,-0.4,0,0,0,0],[0,0,0,0,0,0,0],[-0.4,0,0.4,0,0,0,0],[0,0,0,0,0,0,0],[0,0,0,0,0,0,0],[0,0,0,0,0,0,0],[0,0,0,0,0,0,0]]}],"tables":[{"vars":["formality","emoji"],"forbid":[["l2","l2"],["l2","l1"]]}],"precedes":[{"before":"step.explain","after":"step.check","gap":1}],"linear":[{"terms":[["humour","l2",2],["humour","l1",1],["emoji","l2",2],["emoji","l1",1]],"limit":3}],"all_different":[{"vars":["step.encourage","step.explain","step.example","step.check"]},{"vars":["free.step.encourage","free.step.explain","free.step.example","free.step.check"]}]}
