{"probbit_ir":1,"comment":"probbit persona Body 1.0.0 seed 7 turn 0; active habits: none","values":["l0","l1","l2"],"vars":[{"id":"verbosity","allowed":["l0","l1","l2"],"h":{"l0":0.1,"l1":0.5,"l2":0.2}},{"id":"pursue","allowed":["l0","l1","l2"],"h":{"l0":-0.788457,"l1":-1.854979,"l2":-2.590918}},{"id":"valence","allowed":["l0","l1","l2"],"h":{}},{"id":"free.verbosity","allowed":["l0","l1","l2"],"h":{"l0":0.1,"l1":0.5,"l2":0.2}},{"id":"free.pursue","allowed":["l0","l1","l2"],"h":{"l0":-0.788457,"l1":-1.854979,"l2":-2.590918}},{"id":"free.valence","allowed":["l0","l1","l2"],"h":{}}]}
