{"probbit_ir": 1, "values": ["0", "1"], "vars": [{"id": "x0"}, {"id": "x1"}, {"id": "x2"}, {"id": "x3"}, {"id": "x4"}, {"id": "x5"}, {"id": "x6"}, {"id": "x7"}, {"id": "x8"}, {"id": "x9"}, {"id": "x10"}, {"id": "x11"}], "pairs": [{"i": "x0", "j": "x1", "potts": 0.5}, {"i": "x0", "j": "x2", "potts": 0.5}, {"i": "x0", "j": "x3", "potts": 0.5}, {"i": "x0", "j": "x4", "potts": 0.5}, {"i": "x0", "j": "x5", "potts": 0.5}, {"i": "x0", "j": "x6", "potts": 0.5}, {"i": "x0", "j": "x7", "potts": 0.5}, {"i": "x0", "j": "x8", "potts": 0.5}, {"i": "x0", "j": "x9", "potts": 0.5}, {"i": "x0", "j": "x10", "potts": 0.5}, {"i": "x0", "j": "x11", "potts": 0.5}, {"i": "x1", "j": "x2", "potts": 0.5}, {"i": "x1", "j": "x3", "potts": 0.5}, {"i": "x1", "j": "x4", "potts": 0.5}, {"i": "x1", "j": "x5", "potts": 0.5}, {"i": "x1", "j": "x6", "potts": 0.5}, {"i": "x1", "j": "x7", "potts": 0.5}, {"i": "x1", "j": "x8", "potts": 0.5}, {"i": "x1", "j": "x9", "potts": 0.5}, {"i": "x1", "j": "x10", "potts": 0.5}, {"i": "x1", "j": "x11", "potts": 0.5}, {"i": "x2", "j": "x3", "potts": 0.5}, {"i": "x2", "j": "x4", "potts": 0.5}, {"i": "x2", "j": "x5", "potts": 0.5}, {"i": "x2", "j": "x6", "potts": 0.5}, {"i": "x2", "j": "x7", "potts": 0.5}, {"i": "x2", "j": "x8", "potts": 0.5}, {"i": "x2", "j": "x9", "potts": 0.5}, {"i": "x2", "j": "x10", "potts": 0.5}, {"i": "x2", "j": "x11", "potts": 0.5}, {"i": "x3", "j": "x4", "potts": 0.5}, {"i": "x3", "j": "x5", "potts": 0.5}, {"i": "x3", "j": "x6", "potts": 0.5}, {"i": "x3", "j": "x7", "potts": 0.5}, {"i": "x3", "j": "x8", "potts": 0.5}, {"i": "x3", "j": "x9", "potts": 0.5}, {"i": "x3", "j": "x10", "potts": 0.5}, {"i": "x3", "j": "x11", "potts": 0.5}, {"i": "x4", "j": "x5", "potts": 0.5}, {"i": "x4", "j": "x6", "potts": 0.5}, {"i": "x4", "j": "x7", "potts": 0.5}, {"i": "x4", "j": "x8", "potts": 0.5}, {"i": "x4", "j": "x9", "potts": 0.5}, {"i": "x4", "j": "x10", "potts": 0.5}, {"i": "x4", "j": "x11", "potts": 0.5}, {"i": "x5", "j": "x6", "potts": 0.5}, {"i": "x5", "j": "x7", "potts": 0.5}, {"i": "x5", "j": "x8", "potts": 0.5}, {"i": "x5", "j": "x9", "potts": 0.5}, {"i": "x5", "j": "x10", "potts": 0.5}, {"i": "x5", "j": "x11", "potts": 0.5}, {"i": "x6", "j": "x7", "potts": 0.5}, {"i": "x6", "j": "x8", "potts": 0.5}, {"i": "x6", "j": "x9", "potts": 0.5}, {"i": "x6", "j": "x10", "potts": 0.5}, {"i": "x6", "j": "x11", "potts": 0.5}, {"i": "x7", "j": "x8", "potts": 0.5}, {"i": "x7", "j": "x9", "potts": 0.5}, {"i": "x7", "j": "x10", "potts": 0.5}, {"i": "x7", "j": "x11", "potts": 0.5}, {"i": "x8", "j": "x9", "potts": 0.5}, {"i": "x8", "j": "x10", "potts": 0.5}, {"i": "x8", "j": "x11", "potts": 0.5}, {"i": "x9", "j": "x10", "potts": 0.5}, {"i": "x9", "j": "x11", "potts": 0.5}, {"i": "x10", "j": "x11", "potts": 0.5}], "caps": [{"limit": 12, "value": "0"}, {"limit": 12, "value": "0"}]}