{"probbit_ir":1,"comment":"probbit persona Vale 1.0.0 seed 1 turn 0; active habits: none","values":["l0","l1","l2"],"vars":[{"id":"caution","allowed":["l0","l1","l2"],"h":{"l0":-1.567322,"l1":-0.798508,"l2":-1.091938}},{"id":"initiative","allowed":["l0","l1","l2"],"h":{"l0":-1.255573,"l1":-0.798508,"l2":-1.334694}},{"id":"verbosity","allowed":["l0","l1","l2"],"h":{"l0":-1.309275,"l1":-1.049822,"l2":-1.098671}},{"id":"warmth","allowed":["l0","l1","l2"],"h":{"l0":-1.937794,"l1":-0.798508,"l2":-0.652473}},{"id":"valence","allowed":["l0","l1","l2"],"h":{"l0":-1.386294,"l1":-0.693147,"l2":-1.386294}},{"id":"arousal","allowed":["l0","l1","l2"],"h":{"l0":-1.090026,"l1":-0.798508,"l2":-1.500241}},{"id":"free.caution","allowed":["l0","l1","l2"],"h":{"l0":-1.567322,"l1":-0.798508,"l2":-1.091938}},{"id":"free.initiative","allowed":["l0","l1","l2"],"h":{"l0":-1.255573,"l1":-0.798508,"l2":-1.334694}},{"id":"free.verbosity","allowed":["l0","l1","l2"],"h":{"l0":-1.309275,"l1":-1.049822,"l2":-1.098671}},{"id":"free.warmth","allowed":["l0","l1","l2"],"h":{"l0":-1.937794,"l1":-0.798508,"l2":-0.652473}},{"id":"free.valence","allowed":["l0","l1","l2"],"h":{"l0":-1.386294,"l1":-0.693147,"l2":-1.386294}},{"id":"free.arousal","allowed":["l0","l1","l2"],"h":{"l0":-1.090026,"l1":-0.798508,"l2":-1.500241}}],"pairs":[{"i":"valence","j":"warmth","table":[[0.6,0,-0.6],[0,0,0],[-0.6,0,0.6]]},{"i":"arousal","j":"caution","table":[[0.5,0,-0.5],[0,0,0],[-0.5,0,0.5]]},{"i":"free.valence","j":"free.warmth","table":[[0.6,0,-0.6],[0,0,0],[-0.6,0,0.6]]},{"i":"free.arousal","j":"free.caution","table":[[0.5,0,-0.5],[0,0,0],[-0.5,0,0.5]]}]}
