{"probbit_ir":1,"comment":"probbit persona Rook 1.0.0 seed 1 turn 0; active habits: no_bold_lead, report_after_verify","values":["l0","l1","l2","s0","s1","s2","s3","s4"],"vars":[{"id":"warmth","allowed":["l0","l1","l2"],"h":{"l0":-0.454722,"l1":-0.693147,"l2":-2.49222}},{"id":"directness","allowed":["l0","l1","l2"],"h":{"l0":-1.740285,"l1":-0.916291,"l2":-1.255447}},{"id":"verbosity","allowed":["l0","l1","l2"],"h":{"l0":-0.916047,"l1":-0.916291,"l2":-2.079685}},{"id":"humour","allowed":["l0","l1","l2"],"h":{"l0":-0.386875,"l1":-1.386294,"l2":-2.965532}},{"id":"formality","allowed":["l0","l1","l2"],"h":{"l0":-1.367338,"l1":-0.693147,"l2":-1.446073}},{"id":"initiative","allowed":["l0","l1","l2"],"h":{"l0":-0.905173,"l1":-0.693147,"l2":-1.908238}},{"id":"caution","allowed":["l0","l1","l2"],"h":{"l0":-2.078332,"l1":-1.049822,"l2":-1.428226}},{"id":"curiosity","allowed":["l0","l1","l2"],"h":{"l0":-0.700247,"l1":-0.916291,"l2":-2.295485}},{"id":"valence","allowed":["l0","l1","l2"],"h":{"l0":-1.80332,"l1":-0.356675,"l2":-1.99092}},{"id":"arousal","allowed":["l0","l1","l2"],"h":{"l0":-1.082147,"l1":-0.916291,"l2":-1.913585}},{"id":"step.acknowledge","allowed":["s0","s1","s2","s3","s4"],"h":{"s0":0.6,"s1":0.3,"s3":-0.3,"s4":-0.6}},{"id":"step.diagnose","allowed":["s0","s1","s2","s3","s4"],"h":{"s0":0.4,"s1":0.2,"s3":-0.2,"s4":-0.4}},{"id":"step.fix","allowed":["s0","s1","s2","s3","s4"],"h":{"s0":0.1,"s1":0.05,"s3":-0.05,"s4":-0.1}},{"id":"step.verify","allowed":["s0","s1","s2","s3","s4"],"h":{"s0":-0.2,"s1":-0.1,"s3":0.1,"s4":0.2}},{"id":"step.report","allowed":["s0","s1","s2","s3","s4"],"h":{"s0":-0.8,"s1":-0.4,"s3":0.4,"s4":0.8}},{"id":"free.warmth","allowed":["l0","l1","l2"],"h":{"l0":-0.454722,"l1":-0.693147,"l2":-2.49222}},{"id":"free.directness","allowed":["l0","l1","l2"],"h":{"l0":-1.740285,"l1":-0.916291,"l2":-1.255447}},{"id":"free.verbosity","allowed":["l0","l1","l2"],"h":{"l0":-0.916047,"l1":-0.916291,"l2":-2.079685}},{"id":"free.humour","allowed":["l0","l1","l2"],"h":{"l0":-0.386875,"l1":-1.386294,"l2":-2.965532}},{"id":"free.formality","allowed":["l0","l1","l2"],"h":{"l0":-1.367338,"l1":-0.693147,"l2":-1.446073}},{"id":"free.initiative","allowed":["l0","l1","l2"],"h":{"l0":-0.905173,"l1":-0.693147,"l2":-1.908238}},{"id":"free.caution","allowed":["l0","l1","l2"],"h":{"l0":-2.078332,"l1":-1.049822,"l2":-1.428226}},{"id":"free.curiosity","allowed":["l0","l1","l2"],"h":{"l0":-0.700247,"l1":-0.916291,"l2":-2.295485}},{"id":"free.valence","allowed":["l0","l1","l2"],"h":{"l0":-1.80332,"l1":-0.356675,"l2":-1.99092}},{"id":"free.arousal","allowed":["l0","l1","l2"],"h":{"l0":-1.082147,"l1":-0.916291,"l2":-1.913585}},{"id":"free.step.acknowledge","allowed":["s0","s1","s2","s3","s4"],"h":{"s0":0.6,"s1":0.3,"s3":-0.3,"s4":-0.6}},{"id":"free.step.diagnose","allowed":["s0","s1","s2","s3","s4"],"h":{"s0":0.4,"s1":0.2,"s3":-0.2,"s4":-0.4}},{"id":"free.step.fix","allowed":["s0","s1","s2","s3","s4"],"h":{"s0":0.1,"s1":0.05,"s3":-0.05,"s4":-0.1}},{"id":"free.step.verify","allowed":["s0","s1","s2","s3","s4"],"h":{"s0":-0.2,"s1":-0.1,"s3":0.1,"s4":0.2}},{"id":"free.step.report","allowed":["s0","s1","s2","s3","s4"],"h":{"s0":-0.8,"s1":-0.4,"s3":0.4,"s4":0.8}}],"pairs":[{"i":"valence","j":"humour","table":[[0.8,0,-0.8,0,0,0,0,0],[0,0,0,0,0,0,0,0],[-0.8,0,0.8,0,0,0,0,0],[0,0,0,0,0,0,0,0],[0,0,0,0,0,0,0,0],[0,0,0,0,0,0,0,0],[0,0,0,0,0,0,0,0],[0,0,0,0,0,0,0,0]]},{"i":"valence","j":"warmth","table":[[0.4,0,-0.4,0,0,0,0,0],[0,0,0,0,0,0,0,0],[-0.4,0,0.4,0,0,0,0,0],[0,0,0,0,0,0,0,0],[0,0,0,0,0,0,0,0],[0,0,0,0,0,0,0,0],[0,0,0,0,0,0,0,0],[0,0,0,0,0,0,0,0]]},{"i":"arousal","j":"verbosity","table":[[-0.6,0,0.6,0,0,0,0,0],[0,0,0,0,0,0,0,0],[0.6,0,-0.6,0,0,0,0,0],[0,0,0,0,0,0,0,0],[0,0,0,0,0,0,0,0],[0,0,0,0,0,0,0,0],[0,0,0,0,0,0,0,0],[0,0,0,0,0,0,0,0]]},{"i":"arousal","j":"caution","table":[[0.5,0,-0.5,0,0,0,0,0],[0,0,0,0,0,0,0,0],[-0.5,0,0.5,0,0,0,0,0],[0,0,0,0,0,0,0,0],[0,0,0,0,0,0,0,0],[0,0,0,0,0,0,0,0],[0,0,0,0,0,0,0,0],[0,0,0,0,0,0,0,0]]},{"i":"warmth","j":"formality","table":[[-0.5,0,0.5,0,0,0,0,0],[0,0,0,0,0,0,0,0],[0.5,0,-0.5,0,0,0,0,0],[0,0,0,0,0,0,0,0],[0,0,0,0,0,0,0,0],[0,0,0,0,0,0,0,0],[0,0,0,0,0,0,0,0],[0,0,0,0,0,0,0,0]]},{"i":"humour","j":"formality","table":[[-0.6,0,0.6,0,0,0,0,0],[0,0,0,0,0,0,0,0],[0.6,0,-0.6,0,0,0,0,0],[0,0,0,0,0,0,0,0],[0,0,0,0,0,0,0,0],[0,0,0,0,0,0,0,0],[0,0,0,0,0,0,0,0],[0,0,0,0,0,0,0,0]]},{"i":"directness","j":"verbosity","table":[[-0.4,0,0.4,0,0,0,0,0],[0,0,0,0,0,0,0,0],[0.4,0,-0.4,0,0,0,0,0],[0,0,0,0,0,0,0,0],[0,0,0,0,0,0,0,0],[0,0,0,0,0,0,0,0],[0,0,0,0,0,0,0,0],[0,0,0,0,0,0,0,0]]},{"i":"caution","j":"initiative","table":[[-0.3,0,0,0,0,0,0,0],[0,0,0,0,0,0,0,0],[0,0,-0.8,0,0,0,0,0],[0,0,0,0,0,0,0,0],[0,0,0,0,0,0,0,0],[0,0,0,0,0,0,0,0],[0,0,0,0,0,0,0,0],[0,0,0,0,0,0,0,0]]},{"i":"free.valence","j":"free.humour","table":[[0.8,0,-0.8,0,0,0,0,0],[0,0,0,0,0,0,0,0],[-0.8,0,0.8,0,0,0,0,0],[0,0,0,0,0,0,0,0],[0,0,0,0,0,0,0,0],[0,0,0,0,0,0,0,0],[0,0,0,0,0,0,0,0],[0,0,0,0,0,0,0,0]]},{"i":"free.valence","j":"free.warmth","table":[[0.4,0,-0.4,0,0,0,0,0],[0,0,0,0,0,0,0,0],[-0.4,0,0.4,0,0,0,0,0],[0,0,0,0,0,0,0,0],[0,0,0,0,0,0,0,0],[0,0,0,0,0,0,0,0],[0,0,0,0,0,0,0,0],[0,0,0,0,0,0,0,0]]},{"i":"free.arousal","j":"free.verbosity","table":[[-0.6,0,0.6,0,0,0,0,0],[0,0,0,0,0,0,0,0],[0.6,0,-0.6,0,0,0,0,0],[0,0,0,0,0,0,0,0],[0,0,0,0,0,0,0,0],[0,0,0,0,0,0,0,0],[0,0,0,0,0,0,0,0],[0,0,0,0,0,0,0,0]]},{"i":"free.arousal","j":"free.caution","table":[[0.5,0,-0.5,0,0,0,0,0],[0,0,0,0,0,0,0,0],[-0.5,0,0.5,0,0,0,0,0],[0,0,0,0,0,0,0,0],[0,0,0,0,0,0,0,0],[0,0,0,0,0,0,0,0],[0,0,0,0,0,0,0,0],[0,0,0,0,0,0,0,0]]},{"i":"free.warmth","j":"free.formality","table":[[-0.5,0,0.5,0,0,0,0,0],[0,0,0,0,0,0,0,0],[0.5,0,-0.5,0,0,0,0,0],[0,0,0,0,0,0,0,0],[0,0,0,0,0,0,0,0],[0,0,0,0,0,0,0,0],[0,0,0,0,0,0,0,0],[0,0,0,0,0,0,0,0]]},{"i":"free.humour","j":"free.formality","table":[[-0.6,0,0.6,0,0,0,0,0],[0,0,0,0,0,0,0,0],[0.6,0,-0.6,0,0,0,0,0],[0,0,0,0,0,0,0,0],[0,0,0,0,0,0,0,0],[0,0,0,0,0,0,0,0],[0,0,0,0,0,0,0,0],[0,0,0,0,0,0,0,0]]},{"i":"free.directness","j":"free.verbosity","table":[[-0.4,0,0.4,0,0,0,0,0],[0,0,0,0,0,0,0,0],[0.4,0,-0.4,0,0,0,0,0],[0,0,0,0,0,0,0,0],[0,0,0,0,0,0,0,0],[0,0,0,0,0,0,0,0],[0,0,0,0,0,0,0,0],[0,0,0,0,0,0,0,0]]},{"i":"free.caution","j":"free.initiative","table":[[-0.3,0,0,0,0,0,0,0],[0,0,0,0,0,0,0,0],[0,0,-0.8,0,0,0,0,0],[0,0,0,0,0,0,0,0],[0,0,0,0,0,0,0,0],[0,0,0,0,0,0,0,0],[0,0,0,0,0,0,0,0],[0,0,0,0,0,0,0,0]]}],"implies":[{"if":{"var":"caution","value":"l0"},"then":{"var":"initiative","in":["l0","l1"]}}],"precedes":[{"before":"step.verify","after":"step.report","gap":1}],"all_different":[{"vars":["step.acknowledge","step.diagnose","step.fix","step.verify","step.report"]},{"vars":["free.step.acknowledge","free.step.diagnose","free.step.fix","free.step.verify","free.step.report"]}]}
