{"probbit_ir":1,"comment":"probbit persona Pacer 1.0.0 seed 5 turn 0; active habits: none","values":["l0","l1","l2"],"vars":[{"id":"initiative","allowed":["l0","l1","l2"],"h":{"l0":0.2,"l2":-0.2}},{"id":"verbosity","allowed":["l0","l1","l2"],"h":{"l0":-0.2,"l1":0.5,"l2":0.5}},{"id":"pursue","allowed":["l0","l1"],"h":{"l0":-0.405465,"l1":-1.098612}},{"id":"free.initiative","allowed":["l0","l1","l2"],"h":{"l0":0.2,"l2":-0.2}},{"id":"free.verbosity","allowed":["l0","l1","l2"],"h":{"l0":-0.2,"l1":0.5,"l2":0.5}},{"id":"free.pursue","allowed":["l0","l1"],"h":{"l0":-0.405465,"l1":-1.098612}}]}
