{"probbit_ir":1,"comment":"probbit persona Tick 1.0.0 seed 1 turn 0; active habits: never_lead, risk_before_idea","values":["l0","l1","l2","s0","s1","s2"],"vars":[{"id":"warmth","allowed":["l0","l1","l2"],"h":{"l0":-0.661537,"l1":-0.916291,"l2":-2.932032}},{"id":"directness","allowed":["l0","l1","l2"],"h":{"l0":-3.141632,"l1":-1.386294,"l2":-0.210775}},{"id":"verbosity","allowed":["l0","l1","l2"],"h":{"l0":-0.930275,"l1":-1.386294,"l2":-2.422132}},{"id":"humour","allowed":["l0","l1","l2"],"h":{"l0":-0.458919,"l1":-2.040221,"l2":-3.615623}},{"id":"formality","allowed":["l0","l1","l2"],"h":{"l0":-1.382873,"l1":-0.693147,"l2":-1.430538}},{"id":"initiative","allowed":["l0","l1","l2"],"h":{"l0":-0.356526,"l1":-1.049822,"l2":-3.150032}},{"id":"caution","allowed":["l0","l1","l2"],"h":{"l0":-2.451385,"l1":-0.693147,"l2":-0.767491}},{"id":"curiosity","allowed":["l0","l1","l2"],"h":{"l0":-0.813182,"l1":-1.609438,"l2":-2.470232}},{"id":"valence","allowed":["l0","l1","l2"],"h":{"l0":-1.65342,"l1":-0.356675,"l2":-2.14082}},{"id":"arousal","allowed":["l0","l1","l2"],"h":{"l0":-0.472591,"l1":-0.916291,"l2":-2.053138}},{"id":"step.number","allowed":["s0","s1","s2"],"h":{"s0":1,"s2":-1}},{"id":"step.risk","allowed":["s0","s1","s2"],"h":{}},{"id":"step.idea","allowed":["s0","s1","s2"],"h":{"s0":-0.6,"s2":0.6}},{"id":"free.warmth","allowed":["l0","l1","l2"],"h":{"l0":-0.661537,"l1":-0.916291,"l2":-2.932032}},{"id":"free.directness","allowed":["l0","l1","l2"],"h":{"l0":-3.141632,"l1":-1.386294,"l2":-0.210775}},{"id":"free.verbosity","allowed":["l0","l1","l2"],"h":{"l0":-0.930275,"l1":-1.386294,"l2":-2.422132}},{"id":"free.humour","allowed":["l0","l1","l2"],"h":{"l0":-0.458919,"l1":-2.040221,"l2":-3.615623}},{"id":"free.formality","allowed":["l0","l1","l2"],"h":{"l0":-1.382873,"l1":-0.693147,"l2":-1.430538}},{"id":"free.initiative","allowed":["l0","l1","l2"],"h":{"l0":-0.356526,"l1":-1.049822,"l2":-3.150032}},{"id":"free.caution","allowed":["l0","l1","l2"],"h":{"l0":-2.451385,"l1":-0.693147,"l2":-0.767491}},{"id":"free.curiosity","allowed":["l0","l1","l2"],"h":{"l0":-0.813182,"l1":-1.609438,"l2":-2.470232}},{"id":"free.valence","allowed":["l0","l1","l2"],"h":{"l0":-1.65342,"l1":-0.356675,"l2":-2.14082}},{"id":"free.arousal","allowed":["l0","l1","l2"],"h":{"l0":-0.472591,"l1":-0.916291,"l2":-2.053138}},{"id":"free.step.number","allowed":["s0","s1","s2"],"h":{"s0":1,"s2":-1}},{"id":"free.step.risk","allowed":["s0","s1","s2"],"h":{}},{"id":"free.step.idea","allowed":["s0","s1","s2"],"h":{"s0":-0.6,"s2":0.6}}],"pairs":[{"i":"valence","j":"humour","table":[[0.6,0,-0.6,0,0,0],[0,0,0,0,0,0],[-0.6,0,0.6,0,0,0],[0,0,0,0,0,0],[0,0,0,0,0,0],[0,0,0,0,0,0]]},{"i":"arousal","j":"verbosity","table":[[-0.8,0,0.8,0,0,0],[0,0,0,0,0,0],[0.8,0,-0.8,0,0,0],[0,0,0,0,0,0],[0,0,0,0,0,0],[0,0,0,0,0,0]]},{"i":"arousal","j":"caution","table":[[0.6,0,-0.6,0,0,0],[0,0,0,0,0,0],[-0.6,0,0.6,0,0,0],[0,0,0,0,0,0],[0,0,0,0,0,0],[0,0,0,0,0,0]]},{"i":"directness","j":"verbosity","table":[[-0.5,0,0.5,0,0,0],[0,0,0,0,0,0],[0.5,0,-0.5,0,0,0],[0,0,0,0,0,0],[0,0,0,0,0,0],[0,0,0,0,0,0]]},{"i":"valence","j":"warmth","table":[[0.3,0,-0.3,0,0,0],[0,0,0,0,0,0],[-0.3,0,0.3,0,0,0],[0,0,0,0,0,0],[0,0,0,0,0,0],[0,0,0,0,0,0]]},{"i":"caution","j":"initiative","table":[[0,0,0.3,0,0,0],[0,0,0,0,0,0],[0,0,-1,0,0,0],[0,0,0,0,0,0],[0,0,0,0,0,0],[0,0,0,0,0,0]]},{"i":"free.valence","j":"free.humour","table":[[0.6,0,-0.6,0,0,0],[0,0,0,0,0,0],[-0.6,0,0.6,0,0,0],[0,0,0,0,0,0],[0,0,0,0,0,0],[0,0,0,0,0,0]]},{"i":"free.arousal","j":"free.verbosity","table":[[-0.8,0,0.8,0,0,0],[0,0,0,0,0,0],[0.8,0,-0.8,0,0,0],[0,0,0,0,0,0],[0,0,0,0,0,0],[0,0,0,0,0,0]]},{"i":"free.arousal","j":"free.caution","table":[[0.6,0,-0.6,0,0,0],[0,0,0,0,0,0],[-0.6,0,0.6,0,0,0],[0,0,0,0,0,0],[0,0,0,0,0,0],[0,0,0,0,0,0]]},{"i":"free.directness","j":"free.verbosity","table":[[-0.5,0,0.5,0,0,0],[0,0,0,0,0,0],[0.5,0,-0.5,0,0,0],[0,0,0,0,0,0],[0,0,0,0,0,0],[0,0,0,0,0,0]]},{"i":"free.valence","j":"free.warmth","table":[[0.3,0,-0.3,0,0,0],[0,0,0,0,0,0],[-0.3,0,0.3,0,0,0],[0,0,0,0,0,0],[0,0,0,0,0,0],[0,0,0,0,0,0]]},{"i":"free.caution","j":"free.initiative","table":[[0,0,0.3,0,0,0],[0,0,0,0,0,0],[0,0,-1,0,0,0],[0,0,0,0,0,0],[0,0,0,0,0,0],[0,0,0,0,0,0]]}],"tables":[{"vars":["initiative"],"allow":[["l0"],["l1"]]}],"precedes":[{"before":"step.risk","after":"step.idea","gap":1}],"all_different":[{"vars":["step.number","step.risk","step.idea"]},{"vars":["free.step.number","free.step.risk","free.step.idea"]}]}
