{
 "probbit_ir": 1,
 "comment": "tool-call plan over 6 steps",
 "values": [
  "search",
  "read",
  "code",
  "test",
  "ask",
  "stop"
 ],
 "vars": [
  {
   "id": "s0",
   "h": {
    "search": 0.2453,
    "read": 0.4495,
    "code": -0.3371,
    "test": -0.2541,
    "ask": 0.1924,
    "stop": -0.345
   },
   "forbid": [
    "test"
   ]
  },
  {
   "id": "s1",
   "h": {
    "search": 0.4509,
    "read": 0.3005,
    "code": 0.4744,
    "test": -0.0089,
    "ask": -0.1909,
    "stop": -0.09
   }
  },
  {
   "id": "s2",
   "h": {
    "search": 0.3281,
    "read": -0.1322,
    "code": 0.9177,
    "test": 0.4821,
    "ask": -0.2403,
    "stop": 0.4031
   }
  },
  {
   "id": "s3",
   "h": {
    "search": -0.459,
    "read": 0.4123,
    "code": 0.4319,
    "test": 0.84,
    "ask": -0.0444,
    "stop": -0.4212
   }
  },
  {
   "id": "s4",
   "h": {
    "search": -0.4388,
    "read": -0.4024,
    "code": 0.2143,
    "test": 0.2856,
    "ask": -0.2288,
    "stop": -0.2809
   }
  },
  {
   "id": "s5",
   "h": {
    "search": 0.1986,
    "read": -0.0336,
    "code": 0.2759,
    "test": 0.133,
    "ask": 0.161,
    "stop": 0.0512
   }
  }
 ],
 "pairs": [
  {
   "i": "s0",
   "j": "s1",
   "table": [
    [
     -0.3148,
     0.7295,
     -0.0584,
     0.0872,
     -0.0455,
     0.0852
    ],
    [
     0.0997,
     -0.3939,
     0.6439,
     -0.0684,
     0.0674,
     0.0236
    ],
    [
     0.0035,
     -0.0957,
     -0.3628,
     0.9096,
     -0.0275,
     0.0838
    ],
    [
     0.0945,
     0.0505,
     0.2245,
     -0.3037,
     -0.0976,
     0.7432
    ],
    [
     0.0436,
     -0.0195,
     0.3877,
     -0.0539,
     -0.4265,
     -0.0504
    ],
    [
     0.0479,
     0.0123,
     0.0497,
     0.0448,
     -0.0054,
     0.0077
    ]
   ]
  },
  {
   "i": "s1",
   "j": "s2",
   "table": [
    [
     -0.3148,
     0.7295,
     -0.0584,
     0.0872,
     -0.0455,
     0.0852
    ],
    [
     0.0997,
     -0.3939,
     0.6439,
     -0.0684,
     0.0674,
     0.0236
    ],
    [
     0.0035,
     -0.0957,
     -0.3628,
     0.9096,
     -0.0275,
     0.0838
    ],
    [
     0.0945,
     0.0505,
     0.2245,
     -0.3037,
     -0.0976,
     0.7432
    ],
    [
     0.0436,
     -0.0195,
     0.3877,
     -0.0539,
     -0.4265,
     -0.0504
    ],
    [
     0.0479,
     0.0123,
     0.0497,
     0.0448,
     -0.0054,
     0.0077
    ]
   ]
  },
  {
   "i": "s2",
   "j": "s3",
   "table": [
    [
     -0.3148,
     0.7295,
     -0.0584,
     0.0872,
     -0.0455,
     0.0852
    ],
    [
     0.0997,
     -0.3939,
     0.6439,
     -0.0684,
     0.0674,
     0.0236
    ],
    [
     0.0035,
     -0.0957,
     -0.3628,
     0.9096,
     -0.0275,
     0.0838
    ],
    [
     0.0945,
     0.0505,
     0.2245,
     -0.3037,
     -0.0976,
     0.7432
    ],
    [
     0.0436,
     -0.0195,
     0.3877,
     -0.0539,
     -0.4265,
     -0.0504
    ],
    [
     0.0479,
     0.0123,
     0.0497,
     0.0448,
     -0.0054,
     0.0077
    ]
   ]
  },
  {
   "i": "s3",
   "j": "s4",
   "table": [
    [
     -0.3148,
     0.7295,
     -0.0584,
     0.0872,
     -0.0455,
     0.0852
    ],
    [
     0.0997,
     -0.3939,
     0.6439,
     -0.0684,
     0.0674,
     0.0236
    ],
    [
     0.0035,
     -0.0957,
     -0.3628,
     0.9096,
     -0.0275,
     0.0838
    ],
    [
     0.0945,
     0.0505,
     0.2245,
     -0.3037,
     -0.0976,
     0.7432
    ],
    [
     0.0436,
     -0.0195,
     0.3877,
     -0.0539,
     -0.4265,
     -0.0504
    ],
    [
     0.0479,
     0.0123,
     0.0497,
     0.0448,
     -0.0054,
     0.0077
    ]
   ]
  },
  {
   "i": "s4",
   "j": "s5",
   "table": [
    [
     -0.3148,
     0.7295,
     -0.0584,
     0.0872,
     -0.0455,
     0.0852
    ],
    [
     0.0997,
     -0.3939,
     0.6439,
     -0.0684,
     0.0674,
     0.0236
    ],
    [
     0.0035,
     -0.0957,
     -0.3628,
     0.9096,
     -0.0275,
     0.0838
    ],
    [
     0.0945,
     0.0505,
     0.2245,
     -0.3037,
     -0.0976,
     0.7432
    ],
    [
     0.0436,
     -0.0195,
     0.3877,
     -0.0539,
     -0.4265,
     -0.0504
    ],
    [
     0.0479,
     0.0123,
     0.0497,
     0.0448,
     -0.0054,
     0.0077
    ]
   ]
  }
 ],
 "caps": [
  {
   "value": "search",
   "limit": 2
  },
  {
   "value": "ask",
   "limit": 1
  }
 ],
 "implies": [
  {
   "if": {
    "var": "s0",
    "value": "stop"
   },
   "then": {
    "var": "s1",
    "in": [
     "stop"
    ]
   }
  },
  {
   "if": {
    "var": "s1",
    "value": "stop"
   },
   "then": {
    "var": "s2",
    "in": [
     "stop"
    ]
   }
  },
  {
   "if": {
    "var": "s2",
    "value": "stop"
   },
   "then": {
    "var": "s3",
    "in": [
     "stop"
    ]
   }
  },
  {
   "if": {
    "var": "s3",
    "value": "stop"
   },
   "then": {
    "var": "s4",
    "in": [
     "stop"
    ]
   }
  },
  {
   "if": {
    "var": "s4",
    "value": "stop"
   },
   "then": {
    "var": "s5",
    "in": [
     "stop"
    ]
   }
  },
  {
   "if": {
    "var": "s1",
    "value": "test"
   },
   "then": {
    "var": "s0",
    "in": [
     "code",
     "test"
    ]
   }
  },
  {
   "if": {
    "var": "s2",
    "value": "test"
   },
   "then": {
    "var": "s1",
    "in": [
     "code",
     "test"
    ]
   }
  },
  {
   "if": {
    "var": "s3",
    "value": "test"
   },
   "then": {
    "var": "s2",
    "in": [
     "code",
     "test"
    ]
   }
  },
  {
   "if": {
    "var": "s4",
    "value": "test"
   },
   "then": {
    "var": "s3",
    "in": [
     "code",
     "test"
    ]
   }
  },
  {
   "if": {
    "var": "s5",
    "value": "test"
   },
   "then": {
    "var": "s4",
    "in": [
     "code",
     "test"
    ]
   }
  }
 ],
 "linear": [
  {
   "terms": [
    [
     "s0",
     "search",
     3
    ],
    [
     "s0",
     "read",
     2
    ],
    [
     "s0",
     "code",
     5
    ],
    [
     "s0",
     "test",
     4
    ],
    [
     "s0",
     "ask",
     1
    ],
    [
     "s1",
     "search",
     3
    ],
    [
     "s1",
     "read",
     2
    ],
    [
     "s1",
     "code",
     5
    ],
    [
     "s1",
     "test",
     4
    ],
    [
     "s1",
     "ask",
     1
    ],
    [
     "s2",
     "search",
     3
    ],
    [
     "s2",
     "read",
     2
    ],
    [
     "s2",
     "code",
     5
    ],
    [
     "s2",
     "test",
     4
    ],
    [
     "s2",
     "ask",
     1
    ],
    [
     "s3",
     "search",
     3
    ],
    [
     "s3",
     "read",
     2
    ],
    [
     "s3",
     "code",
     5
    ],
    [
     "s3",
     "test",
     4
    ],
    [
     "s3",
     "ask",
     1
    ],
    [
     "s4",
     "search",
     3
    ],
    [
     "s4",
     "read",
     2
    ],
    [
     "s4",
     "code",
     5
    ],
    [
     "s4",
     "test",
     4
    ],
    [
     "s4",
     "ask",
     1
    ],
    [
     "s5",
     "search",
     3
    ],
    [
     "s5",
     "read",
     2
    ],
    [
     "s5",
     "code",
     5
    ],
    [
     "s5",
     "test",
     4
    ],
    [
     "s5",
     "ask",
     1
    ]
   ],
   "limit": 18
  }
 ]
}