{"probbit_ir": 1, "values": ["0", "1"], "vars": [{"id": "x0", "h": {"0": 0.0, "1": 0.0}}, {"id": "x1", "h": {"0": 0.0, "1": 0.7902127567941886}}, {"id": "x2", "h": {"0": 0.0, "1": 0.2464573938904359}}, {"id": "x3", "h": {"0": 0.0, "1": -0.713345803583149}}, {"id": "x4", "h": {"0": 0.0, "1": -0.4689409544026985}}, {"id": "x5", "h": {"0": 0.0, "1": 0.5670890334704333}}, {"id": "x6", "h": {"0": 0.0, "1": 0.6458088726833071}}, {"id": "x7", "h": {"0": 0.0, "1": -0.3656693900334405}}, {"id": "x8", "h": {"0": 0.0, "1": -0.7598565441721384}}, {"id": "x9", "h": {"0": 0.0, "1": 0.12867971605373718}}, {"id": "x10", "h": {"0": 0.0, "1": 0.7999901248976964}}, {"id": "x11", "h": {"0": 0.0, "1": 0.12082711565098332}}, {"id": "x12", "h": {"0": 0.0, "1": -0.7623056712127815}}, {"id": "x13", "h": {"0": 0.0, "1": -0.358580641470022}}, {"id": "x14", "h": {"0": 0.0, "1": 0.6504688910084337}}, {"id": "x15", "h": {"0": 0.0, "1": 0.5614536858576052}}, {"id": "x16", "h": {"0": 0.0, "1": -0.4753585665838889}}, {"id": "x17", "h": {"0": 0.0, "1": -0.7097120282805323}}, {"id": "x18", "h": {"0": 0.0, "1": 0.25400833476490176}}, {"id": "x19", "h": {"0": 0.0, "1": 0.7889340247294102}}, {"id": "x20", "h": {"0": 0.0, "1": -0.00794976128005713}}, {"id": "x21", "h": {"0": 0.0, "1": -0.7914134550224399}}, {"id": "x22", "h": {"0": 0.0, "1": -0.23888211524640124}}, {"id": "x23", "h": {"0": 0.0, "1": 0.7169091356926554}}, {"id": "x24", "h": {"0": 0.0, "1": 0.46247703410832824}}, {"id": "x25", "h": {"0": 0.0, "1": -0.5726683808066856}}, {"id": "x26", "h": {"0": 0.0, "1": -0.6410850804649261}}, {"id": "x27", "h": {"0": 0.0, "1": 0.3727220285933701}}, {"id": "x28", "h": {"0": 0.0, "1": 0.7573323809835195}}, {"id": "x29", "h": {"0": 0.0, "1": -0.13651960928131507}}, {"id": "x30", "h": {"0": 0.0, "1": -0.7999111255420256}}, {"id": "x31", "h": {"0": 0.0, "1": -0.11296258352058929}}, {"id": "x32", "h": {"0": 0.0, "1": 0.7646795202531391}}, {"id": "x33", "h": {"0": 0.0, "1": 0.3514564829199705}}, {"id": "x34", "h": {"0": 0.0, "1": -0.6550646752615726}}, {"id": "x35", "h": {"0": 0.0, "1": -0.5557628944611087}}, {"id": "x36", "h": {"0": 0.0, "1": 0.4817292369100457}}, {"id": "x37", "h": {"0": 0.0, "1": 0.7060081686216211}}, {"id": "x38", "h": {"0": 0.0, "1": -0.2615341922112596}}, {"id": "x39", "h": {"0": 0.0, "1": -0.7875773851034245}}, {"id": "x40", "h": {"0": 0.0, "1": 0.01589873751790022}}, {"id": "x41", "h": {"0": 0.0, "1": 0.7925360008447178}}, {"id": "x42", "h": {"0": 0.0, "1": 0.23128324689469693}}, {"id": "x43", "h": {"0": 0.0, "1": -0.7204016727285338}}, {"id": "x44", "h": {"0": 0.0, "1": -0.4559674440155836}}, {"id": "x45", "h": {"0": 0.0, "1": 0.5781911769035054}}, {"id": "x46", "h": {"0": 0.0, "1": 0.6362979808297325}}, {"id": "x47", "h": {"0": 0.0, "1": -0.3797378606988402}}, {"id": "x48", "h": {"0": 0.0, "1": -0.7547334309090802}}, {"id": "x49", "h": {"0": 0.0, "1": 0.1443460211410171}}, {"id": "x50", "h": {"0": 0.0, "1": 0.7997531346319031}}, {"id": "x51", "h": {"0": 0.0, "1": 0.10508689628836519}}, {"id": "x52", "h": {"0": 0.0, "1": -0.766977856874639}}, {"id": "x53", "h": {"0": 0.0, "1": -0.3442976178968777}}, {"id": "x54", "h": {"0": 0.0, "1": 0.6595957716071247}}, {"id": "x55", "h": {"0": 0.0, "1": 0.5500172212489475}}, {"id": "x56", "h": {"0": 0.0, "1": -0.488052336274831}}, {"id": "x57", "h": {"0": 0.0, "1": -0.702234590364085}}, {"id": "x58", "h": {"0": 0.0, "1": 0.2690342230479868}}, {"id": "x59", "h": {"0": 0.0, "1": 0.7861429718849564}}, {"id": "x60", "h": {"0": 0.0, "1": -0.02384614374883847}}, {"id": "x61", "h": {"0": 0.0, "1": -0.7935802834091568}}, {"id": "x62", "h": {"0": 0.0, "1": -0.22366153922670878}}, {"id": "x63", "h": {"0": 0.0, "1": 0.7238230698013095}}, {"id": "x64", "h": {"0": 0.0, "1": 0.44941282694917634}}, {"id": "x65", "h": {"0": 0.0, "1": -0.5836568763824942}}, {"id": "x66", "h": {"0": 0.0, "1": -0.6314480465057867}}, {"id": "x67", "h": {"0": 0.0, "1": 0.38671619353351994}}, {"id": "x68", "h": {"0": 0.0, "1": 0.7520599505962192}}, {"id": "x69", "h": {"0": 0.0, "1": -0.15215817877143695}}, {"id": "x70", "h": {"0": 0.0, "1": -0.7995161677689966}}, {"id": "x71", "h": {"0": 0.0, "1": -0.09720083168166813}}, {"id": "x72", "h": {"0": 0.0, "1": 0.769200454115586}}, {"id": "x73", "h": {"0": 0.0, "1": 0.3371047533416378}}, {"id": "x74", "h": {"0": 0.0, "1": -0.6640617325974537}}, {"id": "x75", "h": {"0": 0.0, "1": -0.5442172336087275}}, {"id": "x76", "h": {"0": 0.0, "1": 0.49432724026957886}}, {"id": "x77", "h": {"0": 0.0, "1": 0.6983916661503431}}, {"id": "x78", "h": {"0": 0.0, "1": -0.27650768664392317}}, {"id": "x79", "h": {"0": 0.0, "1": -0.7846309267229041}}, {"id": "x80", "h": {"0": 0.0, "1": 0.03179119516321991}}, {"id": "x81", "h": {"0": 0.0, "1": 0.7945461995924235}}, {"id": "x82", "h": {"0": 0.0, "1": 0.2160177448892319}}, {"id": "x83", "h": {"0": 0.0, "1": -0.7271729890466019}}, {"id": "x84", "h": {"0": 0.0, "1": -0.44281383018025244}}, {"id": "x85", "h": {"0": 0.0, "1": 0.5890649395035681}}, {"id": "x86", "h": {"0": 0.0, "1": 0.626535756426112}}, {"id": "x87", "h": {"0": 0.0, "1": -0.3936563379841612}}, {"id": "x88", "h": {"0": 0.0, "1": -0.7493122040522215}}, {"id": "x89", "h": {"0": 0.0, "1": 0.1599553107187779}}, {"id": "x90", "h": {"0": 0.0, "1": 0.7992002483538818}}, {"id": "x91", "h": {"0": 0.0, "1": 0.08930516845263366}}, {"id": "x92", "h": {"0": 0.0, "1": -0.7713470924935821}}, {"id": "x93", "h": {"0": 0.0, "1": -0.3298785995525953}}, {"id": "x94", "h": {"0": 0.0, "1": 0.6684621172170713}}, {"id": "x95", "h": {"0": 0.0, "1": 0.5383635042916269}}, {"id": "x96", "h": {"0": 0.0, "1": -0.5005533292449292}}, {"id": "x97", "h": {"0": 0.0, "1": -0.6944797754707533}}, {"id": "x98", "h": {"0": 0.0, "1": 0.28395384499145326}}, {"id": "x99", "h": {"0": 0.0, "1": 0.7830413989323503}}], "pairs": [{"i": "x0", "j": "x1", "potts": 1.2}, {"i": "x1", "j": "x2", "potts": 1.2}, {"i": "x2", "j": "x3", "potts": 1.2}, {"i": "x3", "j": "x4", "potts": 1.2}, {"i": "x4", "j": "x5", "potts": 1.2}, {"i": "x5", "j": "x6", "potts": 1.2}, {"i": "x6", "j": "x7", "potts": 1.2}, {"i": "x7", "j": "x8", "potts": 1.2}, {"i": "x8", "j": "x9", "potts": 1.2}, {"i": "x9", "j": "x10", "potts": 1.2}, {"i": "x10", "j": "x11", "potts": 1.2}, {"i": "x11", "j": "x12", "potts": 1.2}, {"i": "x12", "j": "x13", "potts": 1.2}, {"i": "x13", "j": "x14", "potts": 1.2}, {"i": "x14", "j": "x15", "potts": 1.2}, {"i": "x15", "j": "x16", "potts": 1.2}, {"i": "x16", "j": "x17", "potts": 1.2}, {"i": "x17", "j": "x18", "potts": 1.2}, {"i": "x18", "j": "x19", "potts": 1.2}, {"i": "x19", "j": "x20", "potts": 1.2}, {"i": "x20", "j": "x21", "potts": 1.2}, {"i": "x21", "j": "x22", "potts": 1.2}, {"i": "x22", "j": "x23", "potts": 1.2}, {"i": "x23", "j": "x24", "potts": 1.2}, {"i": "x24", "j": "x25", "potts": 1.2}, {"i": "x25", "j": "x26", "potts": 1.2}, {"i": "x26", "j": "x27", "potts": 1.2}, {"i": "x27", "j": "x28", "potts": 1.2}, {"i": "x28", "j": "x29", "potts": 1.2}, {"i": "x29", "j": "x30", "potts": 1.2}, {"i": "x30", "j": "x31", "potts": 1.2}, {"i": "x31", "j": "x32", "potts": 1.2}, {"i": "x32", "j": "x33", "potts": 1.2}, {"i": "x33", "j": "x34", "potts": 1.2}, {"i": "x34", "j": "x35", "potts": 1.2}, {"i": "x35", "j": "x36", "potts": 1.2}, {"i": "x36", "j": "x37", "potts": 1.2}, {"i": "x37", "j": "x38", "potts": 1.2}, {"i": "x38", "j": "x39", "potts": 1.2}, {"i": "x39", "j": "x40", "potts": 1.2}, {"i": "x40", "j": "x41", "potts": 1.2}, {"i": "x41", "j": "x42", "potts": 1.2}, {"i": "x42", "j": "x43", "potts": 1.2}, {"i": "x43", "j": "x44", "potts": 1.2}, {"i": "x44", "j": "x45", "potts": 1.2}, {"i": "x45", "j": "x46", "potts": 1.2}, {"i": "x46", "j": "x47", "potts": 1.2}, {"i": "x47", "j": "x48", "potts": 1.2}, {"i": "x48", "j": "x49", "potts": 1.2}, {"i": "x49", "j": "x50", "potts": 1.2}, {"i": "x50", "j": "x51", "potts": 1.2}, {"i": "x51", "j": "x52", "potts": 1.2}, {"i": "x52", "j": "x53", "potts": 1.2}, {"i": "x53", "j": "x54", "potts": 1.2}, {"i": "x54", "j": "x55", "potts": 1.2}, {"i": "x55", "j": "x56", "potts": 1.2}, {"i": "x56", "j": "x57", "potts": 1.2}, {"i": "x57", "j": "x58", "potts": 1.2}, {"i": "x58", "j": "x59", "potts": 1.2}, {"i": "x59", "j": "x60", "potts": 1.2}, {"i": "x60", "j": "x61", "potts": 1.2}, {"i": "x61", "j": "x62", "potts": 1.2}, {"i": "x62", "j": "x63", "potts": 1.2}, {"i": "x63", "j": "x64", "potts": 1.2}, {"i": "x64", "j": "x65", "potts": 1.2}, {"i": "x65", "j": "x66", "potts": 1.2}, {"i": "x66", "j": "x67", "potts": 1.2}, {"i": "x67", "j": "x68", "potts": 1.2}, {"i": "x68", "j": "x69", "potts": 1.2}, {"i": "x69", "j": "x70", "potts": 1.2}, {"i": "x70", "j": "x71", "potts": 1.2}, {"i": "x71", "j": "x72", "potts": 1.2}, {"i": "x72", "j": "x73", "potts": 1.2}, {"i": "x73", "j": "x74", "potts": 1.2}, {"i": "x74", "j": "x75", "potts": 1.2}, {"i": "x75", "j": "x76", "potts": 1.2}, {"i": "x76", "j": "x77", "potts": 1.2}, {"i": "x77", "j": "x78", "potts": 1.2}, {"i": "x78", "j": "x79", "potts": 1.2}, {"i": "x79", "j": "x80", "potts": 1.2}, {"i": "x80", "j": "x81", "potts": 1.2}, {"i": "x81", "j": "x82", "potts": 1.2}, {"i": "x82", "j": "x83", "potts": 1.2}, {"i": "x83", "j": "x84", "potts": 1.2}, {"i": "x84", "j": "x85", "potts": 1.2}, {"i": "x85", "j": "x86", "potts": 1.2}, {"i": "x86", "j": "x87", "potts": 1.2}, {"i": "x87", "j": "x88", "potts": 1.2}, {"i": "x88", "j": "x89", "potts": 1.2}, {"i": "x89", "j": "x90", "potts": 1.2}, {"i": "x90", "j": "x91", "potts": 1.2}, {"i": "x91", "j": "x92", "potts": 1.2}, {"i": "x92", "j": "x93", "potts": 1.2}, {"i": "x93", "j": "x94", "potts": 1.2}, {"i": "x94", "j": "x95", "potts": 1.2}, {"i": "x95", "j": "x96", "potts": 1.2}, {"i": "x96", "j": "x97", "potts": 1.2}, {"i": "x97", "j": "x98", "potts": 1.2}, {"i": "x98", "j": "x99", "potts": 1.2}]}
